{
  "schema_version": "0.1.0",
  "state_id": "evidence_card:66666666",
  "created_at": "2026-04-27T00:05:00Z",
  "input_hash": "sha256:6666666666666666666666666666666666666666666666666666666666666666",
  "parent_state_ids": ["evidence_span:55555555"],
  "producer": {"name": "phase0-fixture", "version": "0.1.0", "run_id": "fixture"},
  "claim_text": "The paper contains a benchmark limitation relevant to cheap falsification.",
  "interpretation": "This can support a gap candidate, but it is not a complete idea.",
  "evidence_span_ids": ["evidence_span:55555555"],
  "evidence_status": "supported",
  "source_weight": "primary",
  "limitations": ["Only a fixture-level abstract span is represented."]
}
